commit	agg_ms	tests	status	description
exp31_scan_cumsum	0a3adb1	vectorize {x+g(y)}\array to cumsum: scan_compound 0.937->0.035ms	103.197	50	all pass	all pass
exp32_fold_sum	498c2e2	vectorize {x+g(y)}/array to sum: over_custom 0.058->0.004ms	102.150	50	all pass	all pass
exp33_fromiter	c4fc1b6	np.fromiter for float scan results: ewma 0.868->0.685ms	102.560	50	all pass	all pass
exp34_batch_each2	4fcf1dc	dyadic axis fns for batch each-2: vwap_50assets 0.117->0.069ms	101.838	50	all pass	all pass
exp35_take_compile	b7e0e01	# dyad (take) in _expr_to_source: enables *\100000#a compilation	101.967	50	all pass	all pass
exp37_iterative_fib	927cd94	iterative O(n) closure for linear recurrences: fib_20 0.723->0.001ms, fib_25 7.999->0.001ms	93.475	50	all pass	all pass
exp38_int32_argsort	bc3ae83	int64->int32 downcast for argsort on large arrays: grade_up_1M 67.1->66.1ms	92.456	50	all pass	all pass
exp39_counting_sort	a4aa9a9	counting sort for bounded non-neg integers: sort_100K 2.42->0.77ms	90.503	50	all pass	all pass
exp40_parallel_argsort	8054ef9	parallel merge argsort for arrays>=500K: grade_up_1M 66.1->38.4ms	62.982	50	all pass	all pass
exp41_4way_argsort	2a91f53	4-way parallel argsort: grade_up_1M 38.4->26.9ms	51.596	50	all pass	all pass
exp42_lower_threshold	e6b1205	parallel argsort threshold 500K->10K: grade_up_100K 5.3->2.4ms, rank_100K 5.4->2.5ms	45.797	50	all pass	all pass
exp43_8way_argsort	1e21344	adaptive 8-way for >=250K, 4-way for >=10K: grade_up_1M 26.9->23.1ms	42.098	50	all pass	all pass
exp44_hierarchical_merge	cb2222e	hierarchical pair-wise merge: grade_up_1M 23.1->20.8ms	39.712	50	all pass	all pass
exp45_bucket_argsort	5761ea6	bucket argsort for integers: grade_up_1M 20.8->14.8ms, grade_up_100K 2.4->1.6ms	32.109	50	all pass	all pass
exp46_fused_bucket	caab922	fused flatnonzero+sort per bucket: grade_up_1M 14.8->9.8ms	26.329	50	all pass	all pass
exp47_16_workers_buckets	18ee157	16 workers + adaptive 16 buckets for >=250K: grade_up_1M 9.8->6.9ms	23.494	50	all pass	all pass
exp48_parallel_cumsum	769901e	parallel prefix cumsum: running_sum_1M 3.5->1.3ms	21.329	50	all pass	all pass
exp49_parallel_accum	9010dc7	parallel running max/min: 0.34->0.22ms, all drawdowns improved	20.881	50	all pass	all pass
exp50_parallel_flatnonzero	7f03d52	parallel flatnonzero: where 1.03->0.86ms, filter 1.4->1.25ms	20.539	50	all pass	all pass
exp51_parallel_cumprod	27370c7	parallel cumprod: cumul_product 0.35->0.23ms	20.278	50	all pass	all pass
exp52_fused_where	733764e	fused comparison+where: where_50pct 0.86->0.57ms, filter_index 1.25->0.96ms	19.756	50	all pass	all pass
exp53_uint16_radix	2bbf121	uint16 radix sort in bucket argsort: grade_up_1M 6.9->4.3ms, rank_100K 1.4->1.1ms	16.333	50	all pass	all pass
exp54_shift_buckets	bf1477a	power-of-2 bucket size with >>16 shift: grade_up_100K 0.91->0.50ms, rank_100K 1.06->0.64ms	15.437	50	all pass	all pass
exp55_prealloc_cumsum	4c2ea2d	pre-allocate output in parallel cumsum: running_sum_1M 1.31->1.07ms	15.200	50	all pass	all pass
exp56_prealloc_accum	a30fea2	pre-allocate output in running max/min/cumprod: running_max 0.22->0.20ms	15.098	50	all pass	all pass
exp57_uint8_buckets	5d71a25	uint8 bucket_ids (1MB vs 4MB) for faster flatnonzero scans	15.070	50	all pass	all pass
exp58_prefix_scan_lr	3c70ade	prefix scan for affine recurrences: ewma_10K 0.68->0.30ms	14.700	50	all pass	all pass
exp59_fused_filter	1f68e30	fused parallel filter a@&(a>val): filter_index_1M 0.97->0.69ms	14.388	50	all pass	all pass
exp60_inplace_offset	cd51cde	in-place add for flatnonzero chunk offsets: where 0.60->0.53ms	14.278	50	all pass	all pass
2d5556b	13.950	pass	keep	exp61: pre-compute uint16 sort keys in bucket argsort (grade_up_1M: 4.05->3.66ms)
de4b509	13.803	pass	keep	exp62: adaptive shift for bucket argsort (grade_up_100K: 0.48->0.45ms, rank_100K: 0.63->0.58ms)
7de94cf	13.616	pass	keep	exp63: argsort-based sort for large wide-range integers (sort_100K: 0.76->0.55ms)
5eb9d1d	13.513	pass	keep	exp64: parallel pre-computation for large int argsort (grade_up_1M: 3.66->3.55ms)
117e5ac	13.432	pass	keep	exp65: direct value bucket sort in _fast_sort (sort_100K: 0.56->0.44ms)
a6994a8	13.339	pass	keep	exp66: parallel fused count_nonzero for #&(a>val) (count_filter_1M: 0.38->0.24ms)
d9138e3	13.135	pass	keep	exp67: pre-allocated buffers in Hillis-Steele prefix scan (ewma_10K: 0.309->0.134ms)
48cd8ca	13.161	pass	keep	exp68: compile ? (unique) monad, eliminates last negative cache entry
7f1b6ac	13.154	pass	keep	exp70: fix parallel prefix accumulation bug in _cumprod, _running_max, _running_min
exp71	13.076	pass	keep	exp71: early termination in _prefix_scan_linear for |c_x|<1 (ewma_10K: 0.132->0.060ms, 2.2x faster)
exp72	12.960	pass	keep	exp72: parallel chunked eval for element-wise 2-var compiled expressions (vec_arith_chain_1M: 0.939->0.722ms, 22% faster)
exp73	12.998	pass	keep	exp73: adaptive chunk count for _fused_filter (6 chunks for n>=750K), move import math to module level
exp74	12.461	pass	keep	exp74: cffi JIT for fused element-wise eval - compile Python expressions to C via cffi (vec_arith_chain_1M: 0.971->0.328ms, 2.96x faster)
exp75	12.067	pass	keep	exp75: cffi running_max/min/count - fused C loops for sequential ops + count (running_max 1.63x, running_min 1.60x, count_filter 2.0x, risk benchmarks 1.5x)
exp76	11.696	pass	keep	exp76: cffi cumsum/cumprod - fused C loops (running_sum_1M: 1.034->0.949ms, cumul_product_100K: 0.247->0.132ms 1.87x)
exp77	11.250	pass	keep	exp77: hybrid cffi+parallel cumsum for 1M arrays (running_sum_1M: 0.949->0.505ms, 1.88x faster, 4-chunk parallel cffi + prefix propagation)
exp78	11.074	pass	keep	exp78: cffi counting argsort for int arrays n<=500K with range<=2n (grade_up_100K: 0.448->0.319ms 1.40x, rank_100K: 0.579->0.467ms 1.24x)
exp79	10.816	pass	keep	exp79: cffi counting sort values for int arrays n<=500K with range<=2n (sort_100K: 0.455->0.298ms 1.53x)
exp80	10.798	pass	keep	exp80: cffi inverse permutation in _rank (rank_100K: 0.467->0.395ms 1.18x)
exp81	10.629	pass	keep	exp81: cffi single-pass unique for int arrays (unique_100K: 0.194->0.059ms 3.29x)
exp82	10.468	pass	keep	exp82: cffi counting rank for int arrays — bypass argsort (rank_100K: 0.396->0.252ms 1.57x)
exp83	10.46	pass	keep	exp83: native int64 counting argsort — skip int32 cast (grade_up_100K: ~0.320->0.308ms)
exp84	10.47	pass	keep	exp84: cffi counting argsort u16 for bucket sort phase (grade_up_1M: ~3.58->3.55ms marginal)
exp85	10.384	pass	keep	exp85: cffi linear scan for EWMA/affine recurrences (ewma_10K: 0.061->0.016ms 3.8x)
exp85b	10.40	pass	keep	exp85b: cffi linear scan for bare x/y + scan reorder (scan_compound_10K: 0.033->0.020ms)
exp86	10.12	pass	keep	exp86: cffi fused reduce for */expr (compound_ret_100K: 0.146->0.017ms 8.6x)
exp87	10.12	pass	keep	exp87: extend cffi fused reduce to identity reduces (sum_1M: 0.196->0.131ms 33%)
exp88	10.56	pass	keep	exp88: cffi fused reduce for 2-var + v1 remapping (vwap_100K: 0.042->0.035ms)
exp89	10.23	pass	keep	exp89: add comparison ops to C converter + generic_visit safety
exp90	10.36	pass	keep	exp90: fused running_max/min + expression — single-pass C loops for drawdown patterns (max_drawdown: 0.161->0.130ms 19%)
exp91	10.09	pass	keep	exp91: parallel propagation in cumsum + running_sum_1M: 0.508->0.495ms
exp92	9.72	pass	keep	exp92: cffi branchless filter/where — bypass branch misprediction (filter_index: 0.664->0.369ms 44%, where: 0.521->0.442ms 15%)
exp93	9.68	pass	keep	exp93: reduce filter/where chunk count to 4 — less thread overhead
exp94	9.36	pass	keep	exp94: cffi fused bucket prep for large int argsort — grade_up_1M: 3.55->3.22ms (9.3%)
exp95	8.55	pass	keep	exp95: cffi branchless bucket find for argsort — grade_up_1M: 3.27->2.40ms (26.5%)
exp96	8.39	pass	keep	exp96: smaller buffer in bucket sort — grade_up_1M: 2.40->2.28ms
exp97	8.35	pass	keep	exp97: cumprod early termination on zero — cumul_product_100K: 0.130->0.016ms (88%)
exp98	8.387	pass	keep	exp98: single-array in-place prefix sum for counting argsort (4.5% faster isolated, ~marginal aggregate)
exp99	8.278	pass	keep	exp99: selective -O3 for cffi_utils only (counting_argsort benefits ~8.7%, no running_max regression)
exp100	8.189	pass	keep	exp100: per-element cffi for scan-each on long arrays — drawdown_50assets: 0.206->0.159ms (23%)
